reviewId,userName,userImage,content,score,thumbsUpCount,reviewCreatedVersion,at,replyContent,repliedAt,appVersion
6ae8bf4a-82f2-49fd-8aee-127d9f8718a6,Ichaa Ca,https://play-lh.googleusercontent.com/a/ACg8ocIKmCCSi-C3ubpJ096wF2RGZsX2HXVPD9fyOuEcx3YUkge_Ow=mo,kecewa bangat sama aplikasi ini uang aku di sedot 600 rb,1,0,431.10,2025-10-08 11:14:29,,,431.10
add17956-9870-44d0-9c99-f5e7f4dd2905,Rahmat Hidayatullah,https://play-lh.googleusercontent.com/a-/ALV-UjX2S6GwrMdDwUHHXwIYik-dQvnHunIu6o_CRQ2GjtiJ74Fe64er,"aplikasi yg hanya menguntungkan pengguna iPhone,pengguna android suka ngelag gps nya, zig-zag dan tidak akurat",2,0,431.10,2025-10-08 09:24:57,,,431.10
e1d90d97-8a14-4625-8e14-08b3e077c5b5,Aprlianti nurmia,https://play-lh.googleusercontent.com/a/ACg8ocJiTgj7p8ydnnNytHCc7e6YHoGKs7vZYmc_ta-bxnWLTqR1Zg=mo,taiiii babi kasih kembali uang saya kgkgbabiiiii,1,0,431.10,2025-10-08 07:19:08,,,431.10
ceac6192-4815-448f-beda-a397e209a489,Bagus Dwi Pribadi,https://play-lh.googleusercontent.com/a-/ALV-UjW0qO8G0h8piFimRfONd5h-uicEHbMbzsD2rYXLVwtvNbmT2xSm,mantab,3,0,431.10,2025-10-08 02:58:15,,,431.10
d2720434-8fbe-48ac-ab84-db162f8235ec,Catriyan Dimas,https://play-lh.googleusercontent.com/a-/ALV-UjWjIHonMJIyMY5JX2KjON2L5NdEwCvoAxRxvf4ltIupN6cSWQFt,rekomend bet buat olahraga gak akan nyesel pakenya😁🤗,5,0,424.12,2025-10-08 02:21:23,,,424.12
035e837e-4737-440a-ac9e-b039667467c7,Arima Company,https://play-lh.googleusercontent.com/a/ACg8ocKgibpt7lQGZqvH9q2j39iflUyYncpMfUpcx38vB-1efQfjTw=mo,server error terus,4,0,431.10,2025-10-08 01:16:49,,,431.10
5aeb080f-af3a-46e9-b618-157221e4d0a3,Tomi Hidayat Adipalopo,https://play-lh.googleusercontent.com/a-/ALV-UjVV_18VWe8srseXlkyk2SHvrLHmSL4kkGS252wRRKHlO1DfqVNy,good aplikasi utk olahraga.,5,0,430.12,2025-10-08 01:05:11,,,430.12
73b8494d-844e-409e-8565-e266abbac23f,manda djumala,https://play-lh.googleusercontent.com/a-/ALV-UjUYNGEJCFr_dEbZKQTVHR5MiTyydvZh7gmg7Y1khKN7xbw-490p,masih perlu ditingkatkan menjadi aplikasi non langganan,4,0,431.10,2025-10-08 00:41:22,,,431.10
70979745-f5a0-4620-a15f-6c591fe07f0e,Mishbachul Munir,https://play-lh.googleusercontent.com/a/ACg8ocIDS0XGr9ldktZY0CCeS0sbuDYyedYfQeoKvf-X82WuHf9gTQ=mo,Alhamdulillah.. Mantap Aplikasi Strava. Terus Maju dan Berkembang Dalam Menciptakan Sebuah Karya.. Hebat Strava,5,0,432.11,2025-10-08 00:32:32,,,432.11
91a43f2b-efb1-4413-9fff-e39f7b337ba7,Boy Saputra,https://play-lh.googleusercontent.com/a/ACg8ocIdk9afqv8jzhEiYvvjgKaGhzGmV7KvhSpuxsTLcTGrOoxoBg=mo,"Tolong Refund 609.930,saya tidak pernah menyetujui pembayaran lewat aplikasi dana, tapi kenap dipotong otomatis, seharusnya pembayaran ada verifikasi dari pengguan Dana, ini gak ada sama sekali, tiba2 saldo udah kepotong. tolong kembalikan saldo Dana saya",1,0,431.10,2025-10-08 00:24:04,,,431.10
3e2fd603-a92a-48e3-bb42-0e87c2f08b8a,Muhlis Fiko,https://play-lh.googleusercontent.com/a-/ALV-UjU18PzOpxOu4bWJRqF2JpaFjM17mFAYqAbw0esKC1aZ2NIDCJQ7pQ,sangat membantu,5,0,431.10,2025-10-08 00:17:23,,,431.10
490e460d-60f7-47eb-bd9b-530414e6ad6c,chizhie arhan,https://play-lh.googleusercontent.com/a/ACg8ocIRIFVIRlfI7Dvy6m_Y9yWL0HCyf8VcOibTpht1LQ4mu0JQQg=mo,Suka dan akurat,5,0,427.12,2025-10-08 00:06:34,,,427.12
2748d25a-aa2b-45ed-86d9-fdf695f3ccd9,Shiva Syafi'i,https://play-lh.googleusercontent.com/a/ACg8ocIVqEdSoDDhVBJHOBkx8GIrXd772BDE2VJAqCqXXx7ECypdqA=mo,"bug jarak dan kecepatan tidak akurat, langganan pun percuma",1,0,430.12,2025-10-07 23:52:12,,,430.12
0f9e32df-8a55-4d78-9fd1-882266d2fc45,Bunarante Bunarante,https://play-lh.googleusercontent.com/a/ACg8ocJgcU-IrNee9T9Xuu0sRt9ogiqeJ8JxZ4qSJ7EtNVpGEUfgWg=mo,aplikasi pencuri dana,1,0,431.10,2025-10-07 16:35:28,,,431.10
5c7bffd5-352d-46cc-bf0a-8bbe282abb5b,Akhmad Fadlan Syafiq,https://play-lh.googleusercontent.com/a-/ALV-UjV8dwEB_b-fBzyY1Ja1JpYOjZ_x2-Nuz6rVboa7aRZ7dtuvCFkX,"sebenarnya fiturnya udh bagus,cuman fitur yang tadinya gratis sekarang harus proo,saya berharap fitur yang tadinya gratis untuk update selanjutnya di buka lagi.jadi jangn serba premium pliss ini MH🙏🙏",3,0,431.10,2025-10-07 14:44:24,,,431.10
a877bbe5-d8ca-440f-89ab-f982000094b9,Lest nanzz,https://play-lh.googleusercontent.com/a-/ALV-UjV38tG4R6FL5mQ4cE1fP_zkEZCGyhgWYr-ttqXLOwZYEyJJKMK3,"Tolonglah saya gak bisa login, sudah diulang ulang tetep gak bisa login, jadi tolong perbaiki sistem nya..🤝",1,0,,2025-10-07 09:08:42,,,
f6854413-27ce-489b-8ecc-33ff882122a1,Yayan Yan,https://play-lh.googleusercontent.com/a/ACg8ocIUSzdpepFwHmdFgSi4HPKsKYFokTKsTYnu2v85AmCQdxqpwg=mo,aplikasi tidak dapat di pake,1,0,,2025-10-07 08:08:29,,,
13c94a19-233a-453e-9fd5-750d4d0da8e0,Benny Dibya,https://play-lh.googleusercontent.com/a-/ALV-UjU0impKbS5hk5JgATRCAOMRj_Tt7tXx-Ti2A6HW1zQgcfjjDPA,mantap n detail.,5,0,425.11,2025-10-07 04:20:07,,,425.11
28119867-f6b8-4426-abca-29833a2a4289,Lindyawati Taslim,https://play-lh.googleusercontent.com/a/ACg8ocLpf-4zw2Cgn7sM9P-iQZtRS99G1Rnbzh_-A0NITraKMTkCOg=mo,aplikasi rekomended,5,0,431.10,2025-10-07 01:50:16,,,431.10
0ff95dd7-f117-4aea-a25b-6a9df9e54a66,Fahri Migdad j,https://play-lh.googleusercontent.com/a-/ALV-UjXEZik3zcomPDaCk62V8RnguuaRGYHRhAEyFNTEdZ1uYjpfWgq4,"mantap banget,cumaa agak error strava nyaaa mantappp cokk",5,0,431.10,2025-10-07 00:35:09,,,431.10
e213b5d5-d8a8-48ab-8c23-efb834ce566e,Ajeng Gustian,https://play-lh.googleusercontent.com/a/ACg8ocKN4SPFH5XXKSRkR7OIgCv48SsDwSoR7-nTI9ftjIjK7aGjHA=mo,mantapp,5,0,428.12,2025-10-07 00:28:25,,,428.12
d72de275-cc18-43ee-8455-b765f5dc7dde,Arpi Syahri,https://play-lh.googleusercontent.com/a-/ALV-UjXa3Ayv9KqBfuJJ5w-Yi41XYziS0biDRy2RoYfMilZxUfzKQww0,keren,5,0,431.10,2025-10-07 00:06:30,,,431.10
84771d69-ac7f-4eda-b1e3-f97ccb8fc58c,Arya Nawaf,https://play-lh.googleusercontent.com/a/ACg8ocJZ0u_rI2J6VcDIdRBUNYYLWfexN-jF4yJoPG6lq8icoV76_SE=mo,min strava tolong kembalikan uang saya karena saya tidak sengaja membeli langganan tahunan,2,0,430.12,2025-10-06 23:26:10,,,430.12
1d36a646-cec7-4fe2-bd42-68a843892ff0,Jumiati Saddah,https://play-lh.googleusercontent.com/a-/ALV-UjWu_PSyRf9Ea_kZktyBI8CbJVWpnbDdAc59uRhGCogzV_GVnl4,aplikasi tidak berguna. saya sdh berlangganan 1 th tp tidak bisa digunakan. sudah gitu dana tidak bisa dikembalikan juga.,1,0,,2025-10-06 12:59:35,,,
da03ecdc-c267-4cee-9aa3-33cd1d2ee6f7,I'm AM,https://play-lh.googleusercontent.com/a-/ALV-UjWnG0yFX1n14GTyUZAWOTkYaU223DSHyTEkIP1A1AdX4G0IgJ4t8Q,Strava sangat bagus,5,0,431.10,2025-10-06 02:01:07,,,431.10
e3a6b3db-1602-40a9-a8ee-feecd3f1fb88,Budiawan Novari,https://play-lh.googleusercontent.com/a/ACg8ocI9bKfu6YVlqGEPCA4hHD_xNFTMWZk9Af41sGb2aJOG9p6TVg=mo,Aplikasinya Ok. untuk memantau progress olahraga kita,5,0,431.10,2025-10-06 00:47:29,,,431.10
1f5a41fc-0c74-4d22-b437-643acf6213c9,Haiqal Nih boss,https://play-lh.googleusercontent.com/a/ACg8ocIft8q-UEFtsMo_hi9xqsxK6kIcdGsqdBDUwGsbSVPuztnrHqM=mo,"aplikasi yang menemani saya saat olahraga lari, cocok untuk pemula yang ingin berolahraga untuk kesehatan",5,0,,2025-10-06 00:41:54,,,
95a5c3fe-94d9-424f-bba6-652b91ac5eb8,Tari Lestari,https://play-lh.googleusercontent.com/a/ACg8ocLVxCs6thGhW0Nd6OlWSz3jmv_NUVfmpAIjRGiAfWs1Uyrscw=mo,bermanfaat untuk larii,5,0,431.10,2025-10-06 00:25:57,,,431.10
bdc3d839-7c62-4a94-82b7-e72c5df7e695,Bang Daut,https://play-lh.googleusercontent.com/a-/ALV-UjWQdkY7jdmImjNZVeq3TPJUElIGlcShz6tLde3XtRsJQHkpFvvI,sangat membantu apapun jenis olahraga nya... strava memang mantappp... 👍👍👍,5,0,431.10,2025-10-06 00:09:58,,,431.10
3195b4ed-9695-40ef-b899-05aede135a9f,Lidya Khadijah,https://play-lh.googleusercontent.com/a/ACg8ocLagU1qsAOIrOHTS6FcNqrkz5dwxyDne3XpZdZlQ31GD7I04g=mo,"kurang bagus 2kali garis mapsnya ntah kemana mana padahal sinyal aman gps aman eh malah sampe malaysia garis lari saya, tolong pacemya diperbaiki masa saya jaln.pace 7",1,0,,2025-10-05 23:15:23,,,
697ea498-174b-4409-8573-f97bacf56451,tasya ratna,https://play-lh.googleusercontent.com/a/ACg8ocKPz0NwwIM_RRPeghhPnKfb9XUyrfxXE_0F4Hewp0qIxY3XSw=mo,tolong kembalikan uang saya senilai 609.000 demi kenyamanan bersama kk. uang sy tiba2 ke transaksi sendiri jam 12 malam,2,0,431.10,2025-10-05 22:09:14,,,431.10
36a71246-4b7b-42af-ad22-018d77f8bf8b,Ajid azizi,https://play-lh.googleusercontent.com/a-/ALV-UjX5qy-We7ZWu-TG8IwFGVgYpUD9DwdRl7EUL0WSxkasuukwnOOU,signal gps selalu eror hasil track running saya parah. padahal saya tinggal di tengah-tengah kota yg memungkinkan sinyal stabil. paraaaah,1,1,431.10,2025-10-05 16:23:47,,,431.10
d1faf9a9-3709-4857-9d5c-69bbd9cb4c2e,Nurul Choiri,https://play-lh.googleusercontent.com/a-/ALV-UjWP5Id_duxFJVpKPLcTTKECt_cxG7B_JtMjZWCK_ADO9a3OYIbg,"tidak bisa login, server strava mengalami kesalahan",1,0,431.10,2025-10-05 14:03:26,,,431.10
224db4ee-c8a4-4809-8530-72b1902262ef,Stok akun Hendra,https://play-lh.googleusercontent.com/a/ACg8ocL3I12n-uGmQahpJXHZM3Z9JVo5quiYO3VATv5cA3pEyPcREw=mo,saya kasih bintang 3 dlu soalnya knpa ketika mau di share malah yang keluar kenaikan elev bukan pace yang saya mau liat itu pace bukan kenaikan elev itu ga penting nanti kalo udah bener saya kasi bintang 5 kalo udah diganti lagi jadi pace bukan kenaikan elev,3,0,,2025-10-05 12:35:05,,,
f8dce49f-c77b-45d5-ba44-1cc247db950b,Anila Keswari,https://play-lh.googleusercontent.com/a/ACg8ocLZoLEeOJleecO37nEZeIbQevkFrzfwlLq0Gb9ppm-LYQuEjA=mo,semakin lama semakin ngaco. sering banget eror mohon dong di perbaiki. udah di start dalam posisi sinyal hijau. Uda cape cape lari tau nya ga jalan aplikasi nya. kan bga asik bgt,1,4,430.12,2025-10-05 09:52:19,,,430.12
747772eb-6f5e-4eee-a395-eb73fa43278a,keyya,https://play-lh.googleusercontent.com/a-/ALV-UjUkFqQITApN3fGVkCgHUZFfbHjTpXIOa3GjR36AMhS7zNjMEPQ,dinda bisa pace 2.45,5,0,,2025-10-05 08:53:00,,,
86030e14-f5db-4368-b00e-55608e388177,dndi brkhhh,https://play-lh.googleusercontent.com/a-/ALV-UjVlxxlUo8JB89iHejLdZkBnttYN-Is0ApohfadWhI_U8OrgC5o,"uang saya sebesar 609 ribu di dana hilang di hisap aplikasi ini, tolong di kembalikan",1,0,431.10,2025-10-05 05:25:42,,,431.10
f1da95a4-a729-4f7e-94d7-524b412ad880,nur chamid,https://play-lh.googleusercontent.com/a-/ALV-UjWwWyvI3U8sxJ_gSxtSpMI-0vhKwD9bq89AnA4LHx5Oe5WDwnc,cukup membantu kita untuk mengetahui progres latihan,5,0,431.10,2025-10-05 01:17:17,,,431.10
87808b39-3d22-4e63-a8d0-bf35d0f397b0,Haris Safitri,https://play-lh.googleusercontent.com/a-/ALV-UjXCBZR6oVz6koEwPgxRb4ijBDBg-z9Tr7cvtVRwjvjyKU9OcCM,"Bantu kak, cara ubah dari jarak mil ke KM",5,0,431.10,2025-10-05 01:17:10,,,431.10
f5b41297-a625-4e02-be39-916bba3f9780,Bang Jae Official,https://play-lh.googleusercontent.com/a-/ALV-UjXPdz9JBrW6doYKA9GUzBMG6zG-ovvxKUTFl0KHdadnhfrwSHSh,mantul,5,0,431.10,2025-10-05 01:16:21,,,431.10
03b4154c-7e2b-4075-ac88-f0a07890e88d,Chely “Veyo” Veronica,https://play-lh.googleusercontent.com/a-/ALV-UjUL604LXkOqZLDDKWZp1pggPc-9q8-SRDRKo32pJmDA1a2g80_NUg,keren aplikasinya...,5,0,429.11,2025-10-05 00:42:37,,,429.11
97551f85-a2e1-44e6-94ac-58ddbcc4b9d1,yogi indra,https://play-lh.googleusercontent.com/a/ACg8ocI8Iiv7Z7q-Cz071_FQ2H15GcTd2rJ6HerI-TrNl2hS5cAdqA=mo,sangat membantu untuk hidup sehat.....,5,0,428.12,2025-10-05 00:26:22,,,428.12
f572e692-424a-45f0-9f01-a17c7907c7cc,wiro adikusuma,https://play-lh.googleusercontent.com/a-/ALV-UjUx1MZAy5Nk1mUa3ewdNM11wCC_3e6LeyrCYZuFFqmnEzrO96I,ok,5,0,431.10,2025-10-04 23:11:36,,,431.10
b8f2ad50-17e7-4c20-9f84-43c2c422d3d6,Chenedy Emor,https://play-lh.googleusercontent.com/a/ACg8ocKuafw1pBlm94OJVJJh3RUZXyZg7CxCSoGdYHJwcOK926BnKQ=mo,sudah aktifkan lokasi tetap tidak jadi,1,0,431.10,2025-10-04 22:20:37,,,431.10
99836958-2bef-4ec9-a0f1-adb50148a464,Lucky Gates,https://play-lh.googleusercontent.com/a-/ALV-UjWWWtsm7XnwEypwcidj7L6IqDP4AaUeIyNn6ofTN0fELspzUrc,"Tolong teknisi strava, saya udah capek-capek gowes kadang rute tidak terekam, seluruh opsi latar belakang sudah di aktifkan agar memperlancar perekaman rute saat bersepeda. tetapi, masih di temukan rute yang tidak terekam, dan ini terjadi tidak 100 atau 300 meter. tetapi, beberapa kilometer 🥲.",5,689,431.10,2025-10-04 15:27:59,,,431.10
3fccda87-129c-421b-9bd7-0d22b296e8d6,Arya Ardani,https://play-lh.googleusercontent.com/a/ACg8ocJcTz2jsChkvomQJtnd_ZcnabQu1JdcEFIyHxBcFmJt0W32aA=mo,sigma,5,0,430.12,2025-10-04 12:41:56,,,430.12
a281d09a-a1c9-4f64-a436-71d6428c992f,Marsudi Wibowo,https://play-lh.googleusercontent.com/a-/ALV-UjVWpBTa76q2yqtO_vHIJe9O6GaIRqXSB0a0it2ycgsgL-Vpcvs,"saya menggunakan yg gratis kok pernah ada tagihan via email sebesar Rp 600.000, saya yakin bok..aabok..tak iyyye ya saya abaikan, llla kok enak nyari duwit dg cara malak tanpa berkeringat",4,0,430.12,2025-10-04 06:13:55,,,430.12
6493856d-14c7-488f-a8ad-bec8fe49f3bf,Temmy Kristof Regulus Silooy,https://play-lh.googleusercontent.com/a-/ALV-UjXitHdhkUZHcvkolae8DQ0O7T5Z1ljhl8zZWRGkDJQD7nGZbRuk,good..salam sehat,5,0,431.10,2025-10-04 01:49:59,,,431.10
24a931e3-fd41-4fa6-ac29-1c71c36983d2,zann cupu :v,https://play-lh.googleusercontent.com/a/ACg8ocIK8K61Bmo8JEN05v4YwukRXB8U6AQ113uAAuB4bcr76kkJaKM=mo,well,5,0,431.10,2025-10-04 01:25:09,,,431.10
cf3829be-24a9-4067-aeea-e2cf292f33a1,Novian Susanto,https://play-lh.googleusercontent.com/a/ACg8ocI-Yv49mTvbPeVU61oiALZ9cjUdS_JNbc_rbM5ooM0jaA0M-Q=mo,terukur jadi nya,5,0,431.10,2025-10-04 00:44:22,,,431.10
1df8f825-7a70-4fad-99cb-d3b1b6d64173,ARIF SETIAWAN,https://play-lh.googleusercontent.com/a/ACg8ocLpkjtRoc-gCiYywdWcVT1miIdT3r10sFXu5kWi2AH_1bYsrg=mo,membantu manajemen olahraga,5,0,430.12,2025-10-04 00:32:58,,,430.12
3e3f317c-0c8b-4d68-b2b3-8842f0bb4d7c,Hadi Susanto,https://play-lh.googleusercontent.com/a/ACg8ocIhTUXeVbc5bCrDKpGojszvC_8KB9ziquXNJKoGiy8PbPlbNg=mo,ok,5,0,431.10,2025-10-04 00:31:36,,,431.10
ab1ee80a-f96d-4be7-87ec-b1da18a8133b,Akun Baru,https://play-lh.googleusercontent.com/a/ACg8ocIVOBwZWBpzK3_kImOnBgPEMOQq59KpHrDxDswrCYP1I7xQww=mo,baguss,5,0,429.11,2025-10-04 00:10:16,,,429.11
433b9c5e-0bcb-4d62-b129-f843f0c3abb1,Awank Dhany,https://play-lh.googleusercontent.com/a-/ALV-UjUqMvq8A7Ao1_fmYnLV2iGWI9P4Vldjm2zCP2gV5xe2jnijtA8Z,ok,4,0,431.10,2025-10-03 23:32:57,,,431.10
8681fd28-96f7-47cd-9b00-ec1a6e2d9fc2,Hary,https://play-lh.googleusercontent.com/a-/ALV-UjV4yYroLKj5h_KmJpRkkWBDDdf-lpYTgcrVUrKSewINJ7c61dqB,"saldo dana saya di ambil otomatis sama app strava ini padahal saya tidak mengaktifkan berlagganan dan saya tidak menggunakan app ini..tolong kembalikan saldo saya sebesar 609,930..sangat kecewa sangat merugikan sekali tolong bisa di tindak lanjuti secepatnya",1,5,431.10,2025-10-03 17:07:02,,,431.10
d6d66468-ca71-4c6f-9e31-08bf982d385f,Indah Radiska,https://play-lh.googleusercontent.com/a-/ALV-UjVUmdr0rBpW1sjUHu7KXdeZ81lNxQSAxxNnCoMfym4byRKkj8NF,"agak kecewa krn di versi yg terbaru ini utk jalan kaki udh gak mengukur per langkah lagi tapi pake elevasi ketinggian, begitu juga dgn olahraga lari pace cepet tpi hitungannya tetep lambat dan pengukuran jaraknya juga kadang ngawur",2,0,,2025-10-03 16:18:21,,,
40f48f38-2896-4920-94fc-3c46e7d1dfa0,Anugerah Ponsel,https://play-lh.googleusercontent.com/a/ACg8ocIiiICGR0HKxqXdiK7ZBFEdcMOi9e7rnBOo0FniGP-lxeKHnw=mo,sanggat bagu dan tepat,5,0,,2025-10-03 15:25:02,,,
2b443e5d-ebc9-4326-82c3-05f36d8bf491,Agil Sinaga,https://play-lh.googleusercontent.com/a/ACg8ocLyvS5E6j3hQuo55VKgtWHvH7mmilDLm9e-sXR1dxZu2WRlmg=mo,"yaTuhan tolong kembalikan saldo dana saya... saya tidak sengaja atau ke pencet.. tiba tiba saldo saya kesedot dan dikatakan ada berlangganan tolong kembalikan saldo saya sebesar 609,390.00 tolong saya mohon",1,0,431.10,2025-10-03 11:29:27,,,431.10
626bc0dd-65b4-41c0-b26f-4950d1b318a2,Bill A,https://play-lh.googleusercontent.com/a/ACg8ocLAd1qrXSGKo9QGzI1w7KlY-oyMiA9tw4T0xRQaxKDFhqoR3A=mo,"tolong kembalikan dana saya, gak pernah langganan tiba tiba kesedot 690.390 anjg""",1,0,,2025-10-03 09:00:33,,,
3e92275b-8221-43b3-ab90-5ea33eff4b52,Wong Stres,https://play-lh.googleusercontent.com/a/ACg8ocLBv7r2ZwkJ0XsHYGmFP13Lftm29gDaKaGlkbqVXqPWkx8emA=mo,saya ingin pengajuan pembatalan paket namun tidak diterima,1,0,431.10,2025-10-03 03:59:36,,,431.10
b97dcd52-e6a3-43e4-bc9f-a0400ba2a7d9,Dwika Yulia Rahmawati,https://play-lh.googleusercontent.com/a/ACg8ocK0TF6OzI__v4OWWeaceYRh9GEZTBcBz5N_z7GBHQRU9NXAbQ=mo,kecewa,1,0,,2025-10-03 01:07:35,,,
7939036b-57c7-4307-bb75-1926018c19c6,Agung Darma,https://play-lh.googleusercontent.com/a/ACg8ocJpWGkXCr6tSp1j4lgSIhVHz_6U-2hDuVXbe3gtjHM8-t8fnB8=mo,taman setia setiap saat cri kringat.. mantap,5,0,431.10,2025-10-03 00:49:54,,,431.10
61569847-341f-4d8d-8413-a45567a8eef5,Nafiul Ilmi,https://play-lh.googleusercontent.com/a/ACg8ocLO7ZIraqcOpQZA5Zcm9RygL5sDLeK9uOfhQiEFufNEE30BYg=mo,sangat membantu,5,0,431.10,2025-10-03 00:40:43,,,431.10
9c8db81e-b09a-4ce8-99d5-35f4dd6d1a8f,Budi Dava,https://play-lh.googleusercontent.com/a-/ALV-UjUqPAVb53MTJbH3ljO3vUqWd4k1gxXGDtynMh1ibj6oMxQDzSE,bikin olahraga tambah keren tambah semangat,5,0,407.10,2025-10-03 00:38:32,,,407.10
630f2c11-6567-4c3c-9cc7-5f8a18bb5903,RTP Channel,https://play-lh.googleusercontent.com/a-/ALV-UjVETWj5iGFJZM7zxE7L1K7yNhDnw5GRriC--PfQZHPrHii--Va0,aplikasi saat di record long run. sering keluar sendiri,2,0,427.12,2025-10-03 00:28:35,,,427.12
d8a12249-e947-4167-92c3-e7290f4d06d8,Bakso Pikul Mas Bowo,https://play-lh.googleusercontent.com/a-/ALV-UjVbSDzFYk1FAUVUb9R9YZwN1cjjhoC57MXnYc0IMbbSDIcqtdw,sangat membantu optimasi latihan,5,0,429.11,2025-10-03 00:12:10,,,429.11
0679a31a-9a62-458b-be9b-cab684dd77b8,Awang Ridho Maulana,https://play-lh.googleusercontent.com/a/ACg8ocI3vi32jEI48Egg-Ch5t4hM26KCjpp5WzjRjsIx2SHo1ftOfQ=mo,harusnya dibikin auto save setiap kilometer,1,0,430.12,2025-10-03 00:06:35,,,430.12
92255435-6f66-4524-a698-489b8b92b6c3,Rizki RD,https://play-lh.googleusercontent.com/a-/ALV-UjXVNp3IrfJfPLK5GNFW3bGC8kqBCWVYK8ss8nqLqSO-k3gBZKos,sangat membantu 😎😎😎,5,0,431.10,2025-10-03 00:05:50,,,431.10
7f22c00c-7714-40ef-bbdd-406749f30915,Pinz Tzy,https://play-lh.googleusercontent.com/a-/ALV-UjVdgDFm5V5WfaYwZvEX1QN7JiQv6DhU-wEQ4s865zAOd7feEdkV,saya mendapatkan hal yang tidak mengenakan di aplikasi ini . saldo dana saya hilang 600rb . apakah bisa pengembalian dana . karna itu tidak sengaja atau tidak sah,3,0,431.10,2025-10-02 10:25:01,,,431.10
fc5e1ddc-f28e-4e27-aa1d-96e2901240ac,Oji Andrian,https://play-lh.googleusercontent.com/a/ACg8ocJ5jKzpkimqKgzAuA5HbA-PT4KBBz_RvwXWqKHWGFjHoEax=mo,tolong kembalikan dana saya 609.390 ribu. saya tidak pernah melakukan transaksi aplikasi ini,1,0,430.12,2025-10-02 01:17:14,,,430.12
eaf954c8-3ad1-4a1e-b37a-74011f314d57,Endang Bukorih,https://play-lh.googleusercontent.com/a-/ALV-UjWIZVkN4U748LYy8ouiaSn1rHDpq55JLrzRaawYSfHhuirC_uERlQ,ok semoga bermanfaat,5,0,431.10,2025-10-02 00:58:54,,,431.10
7e5ce166-b7ed-4d8e-ab23-f0d6ddaa3078,dwi nilam zurma,https://play-lh.googleusercontent.com/a-/ALV-UjUw5y-Rxk1WWXsLtnqa57IOwLNeekduIcuzYAXU5IryuiLo6O6A,praktis dan mudah digunakan saat melakukan aktivitas olahraga,5,0,430.12,2025-10-02 00:56:41,,,430.12
39ec4368-228a-4cf4-b4c1-1a5bcfb1d19d,muhammadkhoirul tamim,https://play-lh.googleusercontent.com/a/ACg8ocL2n9CckTy1wF863ihCcpPiP3eWxKZWLZs-PyHXdI3_vbv6Lg=mo,apl yg sangat bagus,5,0,429.11,2025-10-02 00:12:21,,,429.11
a7a9336c-5088-413d-a556-6e02460c3b49,ares fadella mochamad,https://play-lh.googleusercontent.com/a-/ALV-UjUdqmxj9P5J4wn6OWPXVXhtXkKGehv5w5OFzrGvvad6MWpOWGEX,Biar tau progress latihan nya 👍👏,5,0,431.10,2025-10-02 00:04:42,,,431.10
8f4ae329-da4a-48cc-b180-06688e632492,akun saya,https://play-lh.googleusercontent.com/a/ACg8ocI7QS-eEVk70UUgR8EnzxeFiNHVqsc1iRvpKn71UKONJd4S=mo,ini kenapa pace nya gabisa dibagikan??? kenapa yang muncul hanya jarak sama elevasi ajaa??? padahl pengen bikin trend:(,3,0,430.12,2025-10-01 12:43:32,,,430.12
9d651d3c-041e-4440-86e8-061c8749831d,Firman Syah,https://play-lh.googleusercontent.com/a/ACg8ocK-p5T13HbtARX1DGhFbRucgrbKqdHbCIOGamt90n3bZqtJqw=mo,"selmat malam , tolong kembali dana saya ,sya tidak sengaja berlanganang kak tolong saldo saya ketarim sendiri ku harap dana saya di kembalikan lagi",5,0,429.11,2025-10-01 11:22:46,,,429.11
7f20f111-9a63-46ab-8abd-7a9d8c3c1fca,Fatkhur Rizki,https://play-lh.googleusercontent.com/a-/ALV-UjXrz5bdjZjRRZYINzw_lV07TuIua9eXlVyyMz3_wU-utOeBKwvs,saya baru pertama kali pake apk ini tapi kok menurut saya pribadi kurang akurat saat mengukur jarak dan pace,4,0,430.12,2025-10-01 10:34:34,,,430.12
67e90f84-63ce-43ed-ad89-dd18cf5f832a,Ninety's,https://play-lh.googleusercontent.com/a-/ALV-UjXsovCDrFwHcRkWaFzcEAdc9eW0yWn4xspPRuCKloxMwqoGcOLu,rute sesat abal2 kadang rute normal.,4,0,430.12,2025-10-01 09:11:01,,,430.12
688bc5a9-9b65-433c-9c7f-46a111cd18e6,Ade Rahma,https://play-lh.googleusercontent.com/a-/ALV-UjWacbXOG-XGahGyf1vFhWbnPk2Qr46q51f-lQ04F8xFIp_CGRfa,the besttt,5,0,429.11,2025-10-01 05:13:54,,,429.11
5dfa2227-49cd-4b80-8ba4-2a0382bd4313,Ikhwan Hrrn02,https://play-lh.googleusercontent.com/a-/ALV-UjVV6VNXmxEbzq-4TGO9qpiyaYgGdqYBe2ZgNL93kB5-9TPj3bM,ngak debtutorial,4,0,429.11,2025-10-01 02:34:28,,,429.11
e97239b2-3dc9-4f7e-aa8f-5f95b4403c6a,Pungkas Wahyu,https://play-lh.googleusercontent.com/a-/ALV-UjWwMxcgwknKSYGnyqlhJhLYaNmHyuI6d_hPv1c2aMYmo3A8pkYQ,nice,5,0,430.12,2025-10-01 01:05:51,,,430.12
33437b22-14a4-4001-bd9a-26ac703b5ff5,robi usani,https://play-lh.googleusercontent.com/a/ACg8ocJibU0Bvwb3Mwh69tt5LJk_Bel0kJxytRzrW_5RR-5WwSSgsw=mo,alhamdulillah..,5,0,429.11,2025-10-01 00:55:34,,,429.11
3f9fdb26-0e73-47e2-8282-751d2f41a37b,Deni sf belitung Deni sf belitung,https://play-lh.googleusercontent.com/a/ACg8ocIbKJBZgIMNHEI1eE0oNBXce3FPF0MfKT7Pd04yLBfL50aF=mo,sangat memuaskan,5,0,430.12,2025-10-01 00:47:31,,,430.12
9ce7982b-c5aa-4187-90e6-bb2dea4913c9,ENGGAL YU,https://play-lh.googleusercontent.com/a-/ALV-UjUN30hgRVZ2HL63FRwQbpqu8S2CeMa1JWMs46Jqqgr8WxTkvP83,nice very Berry danger,5,0,431.10,2025-10-01 00:28:22,,,431.10
f936ac87-da43-4b20-a94c-426d07c5cd94,MARDIANSEN PATABANG,https://play-lh.googleusercontent.com/a-/ALV-UjUieUZ9AAg-5Yydm5farN_te1o1SGwkKFdgd9WrfJvclTWf1Sk,ok,5,0,430.12,2025-10-01 00:15:34,,,430.12
aeaea1f5-f213-4ced-b333-dbf8b41016fe,Ardian.e.p Tyo,https://play-lh.googleusercontent.com/a/ACg8ocI_yJfz5Baj7LlCqw33z9IikUuZzLPSv9ORwBqktZ-IXhLCmg=mo,keren sekali,5,0,430.12,2025-10-01 00:15:02,,,430.12
972d5723-429b-4a0c-8054-d036e837289d,Muhammad Zakki,https://play-lh.googleusercontent.com/a/ACg8ocKPstEvJsK-4F9dH7z5xcSNh8RNPxODQG09eeF01QKIw2Rkqw=mo,kadang suka error,5,0,429.11,2025-10-01 00:08:29,,,429.11
e357d666-b96f-422c-9d5f-1184e137d7d8,Mama Ram,https://play-lh.googleusercontent.com/a-/ALV-UjVRwfMcnXF5a6QRjPDN91b5H01NwpxqELlpRA5Ejhp1yMKRQ14P,"Aplikasi Gioamat, mau lari baru dia bug bug",1,0,,2025-09-30 21:07:05,,,
a79cf3c3-004e-4c60-bd32-3ae2e8833368,Norman brilian,https://play-lh.googleusercontent.com/a/ACg8ocLvZvJMoKDfojEgkBO_DixkRLsuCpOuLZTsseWzLz5JHvPMtA=mo,keren,5,0,430.12,2025-09-30 20:24:39,,,430.12
c1fa9fe3-3c98-4533-b269-2f68ad938c04,Noel,https://play-lh.googleusercontent.com/a-/ALV-UjV8ObuK4Gl96PxVIkkQ2vDnXF44h6w5A4Y8g8k82WkMFNcECsU,sering error,3,0,430.12,2025-09-30 15:05:20,,,430.12
0a005f6b-87ff-43de-af77-5110fcb75a63,Grace Juli Elia,https://play-lh.googleusercontent.com/a-/ALV-UjW7dl8AwlCmQ-RF5z4gfEWzfRHyvkthdOSZmlAcGaGx8TOtfhe2Bg,saya ga ada berlangganan apa2 700ribu saya di tarik dari gopay tu maksudnya apa,1,0,,2025-09-30 10:10:06,,,
e17e638e-7ccf-4557-84fc-170413ceabac,Dimas Aditya,https://play-lh.googleusercontent.com/a/ACg8ocL-OWFeQYJkD6NqZ8_TUG5DCvCGIiXBzVrsExDvlHVzKZhbAQ=mo,kembalikan saldo saya 609.390 dana tolong kembalikan saldo ya buat beli sepatu udah 2bulan aku ngumpulin uang ya kamu ambil tolong kembalikan ya aku minta tolong banget🙏🙏🙏🙏🙏🙏🙏🙏🙏🙏🙏🙏,1,0,430.12,2025-09-30 10:04:20,,,430.12
1a3674bf-dd97-4269-a607-4f8e016a839d,Adjie Maulana Umar,https://play-lh.googleusercontent.com/a/ACg8ocIng2068qonrv-CyT32KeA_5XDh6f0-_IOcOsZY3nRydUs3CB4=mo,"saya baru download dan saya tidak bisa daftar akun, akun gagal masuk",1,0,431.10,2025-09-30 07:50:11,,,431.10
4e80eee4-a004-42a1-951f-1a76881be403,yovanka lumbantobing,https://play-lh.googleusercontent.com/a-/ALV-UjUi4i_iwsNjamxPRycq4zuVbQ0TFL_WP2e4BUC578XIRZ_pmE83,bagaimana mengubah mil ke km di app ini?,4,0,429.11,2025-09-30 02:44:32,,,429.11
632d3047-aa4d-49b9-979c-6200fdd5ebf4,Hen dra,https://play-lh.googleusercontent.com/a-/ALV-UjVWKnH4NIwE63SKAnJlrixvvSiWhJ921boSRkZBRhp4y6Ytds739Q,sangat bagus...,5,0,430.12,2025-09-30 00:56:18,,,430.12
1e780a88-dcc2-4eb0-84ad-880c70721e9d,Sisworo Putro,https://play-lh.googleusercontent.com/a-/ALV-UjW3dGjNN-ZkntVLqcFPsp6jJnNRvIAk1ceCTK0jl6rN1BbxTIiO,MINTA TOLONG AKURASI DIPERBAIKI,5,0,430.12,2025-09-30 00:25:21,,,430.12
b517d34b-5795-4974-9c74-aed2ea08ccd4,wesii toea,https://play-lh.googleusercontent.com/a/ACg8ocIuowKvKmkwfluYgmFgtQnmo-ZtNtXitSo8qdWOc8REl9FfZg=mo,"sangat bagus,",5,0,430.12,2025-09-30 00:07:48,,,430.12
658b84f5-4550-4615-bf04-a4298bd12b31,Ardiansyah Berau,https://play-lh.googleusercontent.com/a/ACg8ocJsXpwPYsX7ZGzzqr4fQboYlMrndc-nJYtC_qhwoNoH0oBVGg=mo,revisi,5,0,430.12,2025-09-29 23:26:37,,,430.12
eb0033d9-1c8e-40d2-9ed7-3cbf838aeee7,Muhammad iqbal sujati (Iqbal),https://play-lh.googleusercontent.com/a/ACg8ocJh7BDRXz3F-qI45XVJ7gaWfaTa2rp4EagV7stkXty_bsLCWg=mo,"aplikasi babi saya tidak melakukan transaksi langganan, saldo saya tabungan 600rb hilang tanggung jawab ajg",1,1,,2025-09-29 04:14:50,,,
72f07d12-9fe2-4447-9a79-779eaaf421e6,Deni Irawan,https://play-lh.googleusercontent.com/a/ACg8ocJde7coURlX7bHTi7bWEk9rT_w35iVtU0XBf2wkVHA9ld3_oA=mo,ku kasih bintang 3 dulu aplikasinya baguss tapi sayang sering eror jadi tolong di perbaiki,3,0,430.12,2025-09-29 03:42:42,,,430.12
9780b37d-5aa4-4be5-9a51-920f28aff913,jinola Rammadhan Anggara putra,https://play-lh.googleusercontent.com/a-/ALV-UjURvkdb6CSq4KeHW3U2PJFFh80X8PAn8maF4VD9DsUouaruYWk4,"tolong ya untuk developer harus adil, masa merek sepatu kesayangan saya tidak ada. hundred",1,0,430.12,2025-09-29 02:06:07,,,430.12
259c1435-9210-40c6-8277-01d2712b551f,Hairi Hasyim,https://play-lh.googleusercontent.com/a/ACg8ocLyfQv5FkJ8EI57US4ZvmEhCWAuT0OK-EtteoPUwrk35b4pEQ=mo,amazing,5,0,430.12,2025-09-29 00:47:29,,,430.12
